bioguide_id,congress,introduced_date,number,title,type
F000449,110,2007-03-12,1477,Disabled Veterans Commissary and Exchange Store Benefits Act,HR
F000449,110,2007-02-16,1151,To provide for a temporary increase in the number of Iraqi and Afghan translators in the United States Armed Forces who may be provided status as special immigrants.,HR
F000449,110,2007-01-31,761,"To authorize the Secretary of Interior to convey to The Missouri River Basin Lewis and Clark Interpretive Trail and Visitor Center Foundation, Inc. certain Federal land associated with the Lewis and Clark National Historic Trail in Nebraska, to be used as an historical interpretive site along the trail.",HR
F000449,110,2007-01-12,447,"To amend title 38, United States Code, to provide that World War II merchant mariners who were awarded the Mariners Medal shall be provided eligibility for Department of Veterans Affairs health care on the same basis as veterans who have been awarded the Purple Heart.",HR
F000449,110,2007-01-04,125,To provide for a temporary increase in the number of Iraqi and Afghan translators in the United States Armed Forces who may be provided status as special immigrants.,HR
F000449,110,2007-01-04,124,Farm Programs Payment Limitation Integrity Act,HR
F000449,110,2007-01-04,126,To amend the Internal Revenue Code of 1986 to allow loans from individual retirement plans for qualified small business capital assets.,HR
F000449,110,2008-07-30,1391,Prohibiting the House of Representatives from adjourning until it has approved a bill to establish a comprehensive national energy plan that addresses energy conservation and the expansion of renewable and conventional energy sources.,HRES
F000449,110,2008-04-16,1114,Supporting the goals and ideals of the Arbor Day Foundation and National Arbor Day.,HRES
F000449,110,2008-04-16,1113,Celebrating the role of mothers in the United States and supporting the goals and ideals of Mother's Day.,HRES
F000449,110,2008-03-12,1043,"Honoring the life and legacy of Chief Standing Bear, a pioneer in civil rights for Native Americans, on the 100th anniversary of Chief Standing Bear's death.",HRES
F000449,110,2007-05-14,399,Supporting the goals and ideals of Mother's Day.,HRES
F000449,110,2008-04-24,332,Recognizing the 60th anniversary of the Universal Declaration of Human Rights.,HCONRES
F000449,110,2007-12-18,272,"Urging the United States Government to initiate a diplomatic surge to foster security and stability in the Middle East by engaging international stakeholders and governments throughout the region to curtail destabilizing influences, help prevent the spread of violence, address humanitarian concerns, and enhance prospects for security, political, and economic progress in Iraq.",HCONRES
N000181,117,2021-07-09,4394,Clean Energy Protection Act,HR
N000181,117,2021-06-08,3788,Protecting American Innovation Act,HR
N000181,116,2020-07-09,7556,To amend the Internal Revenue Code of 1986 to make a portion of research credit refundable for certain small businesses engaging in specified medical research.,HR
N000181,116,2020-07-09,7555,To amend the Internal Revenue Code of 1986 to add a new medical research component to the credit for increasing research activities.,HR
N000181,116,2020-06-11,7181,Holding China Accountable Act,HR
N000181,116,2020-02-07,5817,Fair and Honest Advance Cost Estimate for Patients Act of 2020,HR
N000181,113,2014-04-30,,,
N000181,113,2014-06-11,4845,To amend the Internal Revenue Code of 1986 to make permanent the deduction for mortgage insurance premiums.,HR
N000181,113,2014-04-09,4434,Africa Counter Terrorism Initiative Act,HR
N000181,113,2013-09-10,3077,TELE-MED Act of 2013,HR
N000181,113,2013-08-02,3043,Tribal General Welfare Exclusion Act of 2014,HR
N000181,113,2013-07-11,2671,Charitable Agricultural Research Act,HR
N000181,113,2013-06-25,2500,Ambulatory Surgical Center Quality and Access Act of 2013,HR
N000181,113,2013-06-05,2270,To impose enhanced penalties for certain drug offense that take place on Federal property.,HR
N000181,113,2013-05-23,2192,National Monument Designation Transparency and Accountability Act,HR
N000181,113,2013-04-18,1628,Public Employee Pension Transparency Act,HR
N000181,112,2012-09-21,6539,United States-Brazil Joint Commission on Commerce and Trade Act,HR
N000181,112,2012-09-21,6536,"To authorize the President to seek to conduct negotiations with the European Union for purposes of entering into a trade agreement with the European Union, and for other purposes.",HR
N000181,112,2012-09-21,6537,Generalized System of Preferences Improvement Act,HR
N000181,112,2012-09-21,6538,"To establish trade negotiating objectives with respect to the application of sanitary and phytosanitary measures to agricultural products, and for other purposes.",HR
N000181,112,2012-06-21,5994,Choice in Healthcare Act,HR
N000181,112,2012-04-27,5259,To suspend temporarily the duty on Fungaflor Technical (Imazalil).,HR
N000181,112,2012-04-26,4849,Sequoia and King Canyon National Parks Backcountry Access Act,HR
N000181,112,2012-04-25,4772,To suspend temporarily the duty on Penbotec 400SC.,HR
N000181,112,2012-04-25,4771,To suspend temporarily the duty on Fungaflor Technical (Imazalil).,HR
N000181,112,2011-09-15,2959,Charitable Agricultural Research Act,HR
N000181,112,2011-07-29,2707,Agricultural Trade Facilitation Act,HR
N000181,112,2011-07-25,2632,Life Sciences Jobs and Investment Act of 2011,HR
N000181,112,2011-05-26,2013,Medicaid Improvement and State Empowerment Act,HR
N000181,112,2011-05-11,1837,Sacramento-San Joaquin Valley Water Reliability Act,HR
N000181,112,2011-04-07,1430,Flood Insurance Choice Act,HR
N000181,112,2011-03-17,1147,CRE Act of 2011,HR
N000181,112,2011-03-10,1018,To amend the Internal Revenue Code of 1986 to make permanent the deduction for mortgage insurance premiums.,HR
N000181,112,2011-03-03,909,Roadmap for America's Energy Future,HR
N000181,112,2011-02-17,758,National Monument Designation Transparency and Accountability Act,HR
N000181,112,2011-02-17,761,San Joaquin Valley Transportation Enhancement Act of 2011,HR
N000181,112,2011-02-17,760,San Joaquin Valley USDA Rural Definition Inclusion Act,HR
N000181,112,2011-02-17,759,Federal Lands Counterdrug Strategy Act,HR
N000181,112,2011-02-09,567,Public Employee Pension Transparency Act,HR
N000181,116,2019-01-08,340,Tulare Youth Recreation and Women’s History Enhancement Act,HR
N000181,115,2018-07-19,6444,Capital Gains Inflation Relief Act,HR
N000181,115,2018-06-28,6290,Public Employee Pension Transparency Act,HR
N000181,115,2018-06-27,6237,Matthew Young Pollard Intelligence Authorization Act for Fiscal Years 2018 and 2019,HR
N000181,115,2018-06-19,6138,ASC Payment Transparency Act of 2018,HR
N000181,115,2018-01-11,98,Directing the Secretary of the Senate to make a correction in the enrollment of the bill S. 139.,HCONRES
N000181,115,2017-12-12,4616,Employer Relief Act of 2018,HR
N000181,115,2017-11-29,4478,FISA Amendments Reauthorization Act of 2017,HR
N000181,115,2017-09-11,3729,"Comprehensive Operations, Sustainability, and Transport Act of 2017",HR
N000181,115,2017-07-13,3236,Ambulance Medicare Budget and Operations Act of 2017,HR
N000181,115,2017-07-11,3180,Intelligence Authorization Act for Fiscal Year 2018,HR
N000181,115,2017-03-30,1838,Ambulatory Surgical Center Quality and Access Act of 2017,HR
N000181,115,2017-02-07,106,Providing amounts for the expenses of the Permanent Select Committee on Intelligence in the One Hundred Fifteenth Congress.,HRES
N000181,115,2017-02-01,805,Tulare Youth Recreation and Women's History Enhancement Act,HR
N000181,115,2017-01-31,76,Providing amounts for the expenses of the Permanent Select Committee on Intelligence in the One Hundred Fifteenth Congress.,HRES
N000181,114,2016-12-08,6480,Intelligence Authorization Act for Fiscal Year 2017,HR
N000181,114,2016-11-22,6393,Intelligence Authorization Act for Fiscal Year 2017,HR
N000181,114,2016-09-28,6271,Foreign Service Optimization Act of 2016,HR
N000181,114,2016-07-14,5872,Low Alcohol Wine Act,HR
N000181,114,2016-07-01,5616,Tulare Youth Recreation and Women's History Enhancement Act,HR
N000181,114,2016-06-15,788,Expressing the sense of the House of Representatives that Arctic lease sales which are already included in the Draft Proposed Plan must stay in the proposed 2017-2022 Outer Continental Shelf Oil & Gas Leasing Program.,HRES
N000181,114,2016-04-27,5077,Intelligence Authorization Act for Fiscal Year 2017,HR
N000181,114,2016-03-21,4822,Public Employee Pension Transparency Act,HR
N000181,114,2016-01-13,4377,American Business Competitiveness Act of 2015,HR
N000181,114,2015-12-15,4257,IRGC Sanctions Act,HR
N000181,114,2015-11-30,4127,Intelligence Authorization Act for Fiscal Year 2016,HR
N000181,114,2015-07-29,3389,National Monument Designation Transparency Act,HR
N000181,114,2015-07-15,3081,TELE-MED Act of 2015,HR
N000181,114,2015-06-25,2937,Cuban Military Transparency Act,HR
N000181,114,2015-06-18,2838,Charitable Agricultural Research Act,HR
N000181,114,2015-04-16,1882,Hearing Aid Assistance Tax Credit Act 2015,HR
N000181,114,2015-03-18,1453,Ambulatory Surgical Center Quality and Access Act of 2015,HR
N000181,114,2015-02-09,817,Fairness in Ambulance Reimbursement Act of 2015,HR
N000181,114,2015-02-03,81,Providing amounts for the expenses of the Permanent Select Committee on Intelligence in the One Hundred Fourteenth Congress.,HRES
N000181,109,2006-12-08,6431,"To direct the Secretary of Health and Human Services to approve the Change In Scope Request submitted by Family HealthCare Network to the Bureau of Primary Health Care on December 8, 2005.",HR
N000181,109,2006-09-29,6295,To amend the Agricultural Adjustment Act to add clementines to the list of fruits and vegetables subject to minimum quality import requirements issued by the Secretary of Agriculture.,HR
N000181,109,2006-07-26,5890,American-Made Energy Freedom Act of 2006,HR
N000181,109,2006-07-11,5760,Giant Sequoia National Monument Transition Act of 2006,HR
N000181,109,2006-05-25,5509,To amend the Internal Revenue Code of 1986 to clarify the tax credit for electricity produced from open-loop biomass.,HR
N000181,109,2005-11-09,4281,To amend the Tariff Act of 1930 and the Internal Revenue Code of 1986 relating to importation of tobacco products.,HR
N000181,109,2005-10-07,4015,Milk Regulatory Equity Act of 2005,HR
N000181,109,2005-09-07,3691,Central Valley Project Reform Act of 2005,HR
N000181,109,2005-05-16,2383,"To redesignate the facility of the Bureau of Reclamation located at 19550 Kelso Road in Byron, California, as the ""C.W. `Bill' Jones Pumping Plant"".",HR
N000181,109,2005-04-26,1851,To suspend temporarily the duty on nylon woolpacks used to package wool.,HR
N000181,109,2005-01-04,99,To designate California State Route 99 as a high priority corridor on the National Highway System and a future route on the Interstate System.,HR
N000181,109,2005-01-25,45,Recognizing the 100th anniversary of the founding of the California League of Food Processors and congratulating the members and officers of the California League of Food Processors for its achievements.,HRES
N000181,114,2015-04-22,,,
N000181,114,2015-06-01,2596,Intelligence Authorization Act for Fiscal Year 2016,HR
N000181,114,2015-03-24,1560,Protecting Cyber Networks Act,HR
N000181,111,2009-06-17,,,
N000181,111,2010-12-02,6484,Public Employee Pension Transparency Act,HR
N000181,111,2010-09-29,6250,Congressional Redistricting Formula Act,HR
N000181,111,2010-07-28,5899,Roadmap for America's Energy Future,HR
N000181,111,2010-06-30,5645,Federal Lands Counterdrug Strategy and Enforcement Enhancement Act,HR
N000181,111,2010-06-23,5580,National Monument Designation Transparency and Accountability Act of 2010,HR
N000181,111,2009-11-17,4087,To extend temporarily the suspension of duty on nylon woolpacks used to package wool.,HR
N000181,111,2009-06-26,3105,Turn on the Pumps Act,HR
N000181,111,2009-04-02,1945,Tule River Tribe Water Development Act,HR
N000181,111,2009-02-11,996,"To temporarily exempt certain public and private development projects from any requirement for a review, statement, or analysis under the National Environmental Policy Act of 1969 (42 U.S.C. 4321 et seq.), and for other purposes.",HR
N000181,111,2009-03-23,276,To provide earmark reform in the House of Representatives.,HRES
N000181,110,2008-09-22,6994,Tule River Tribe Water Development Act,HR
N000181,110,2008-04-16,5825,Hubbard Act,HR
N000181,110,2008-03-05,5539,To suspend temporarily the duty on certain sleeping bags.,HR
N000181,110,2008-03-05,5538,To suspend temporarily the duty on certain sleeping bags.,HR
N000181,110,2007-10-04,3768,San Joaquin River Settlement Water Management Goal Implementation Act,HR
N000181,110,2007-10-04,3767,To provide the Secretary with the authority to increase the number of Customs and Border Protection personnel at Fresno Yosemite International Airport.,HR
N000181,110,2007-08-01,3300,Coal-to-Liquid Fuel Marketing Act of 2007,HR
N000181,110,2007-07-17,3069,Dunlap Band of Mono Indians Reaffirmation Act,HR
N000181,110,2007-05-24,2535,Tule River Tribe Water Development Act,HR
N000181,110,2007-05-14,2305,Energy Conservation through Smart Meters' Act of 2007,HR
N000181,110,2007-03-27,1706,United States Specialty Crop Export Opportunities Act of 2007,HR
N000181,110,2007-02-08,925,Emergency Farm Assistance Act of 2007,HR
N000181,110,2008-09-15,1438,Commemorating the 50th anniversary of the Azorean Refugee Act of 1958 and celebrating the extensive contributions of Portuguese-American communities to the United States.,HRES
N000181,110,2008-07-09,1327,"Congratulating the 2008 National Collegiate Athletic Association (NCAA) Division I Baseball Champions, the Fresno State Bulldogs, on an outstanding and historic season.",HRES
N000181,108,2004-07-12,4817,"To facilitate the resolution of a minor boundary encroachment on lands of the Union Pacific Railroad Company in Tipton, California, which were originally conveyed by the United States as part of the right-of-way granted for the construction of transcontinental railroads.",HR
N000181,108,2004-06-15,4581,"To provide for the conveyance of the former Department of Agriculture Agricultural Research Service laboratory in Fresno, California, to the City of Fresno.",HR
N000181,108,2004-06-03,4508,To amend the National Parks and Recreation Act of 1978 to require the Secretary to permit continued use and occupancy of certain privately owned cabins in the Mineral King Valley in the Sequoia National Park.,HR
N000181,108,2004-04-27,4223,"To require the Commodity Credit Corporation to support the development of a domestic casein and milk protein concentrate industry, and for other purposes.",HR
N000181,108,2004-03-25,4044,To amend the Intermodal Surface Transportation Efficiency Act of 1991 to designate California State Route 99 as a high priority corridor on the National Highway System.,HR
N000181,108,2004-03-10,3932,"To amend Public Law 99-338 to authorize the continued use of certain lands within the Sequoia National Park by portions of an existing hydroelectric project, and for other purposes.",HR
N000181,108,2003-11-06,3467,"To redesignate the facility of the Bureau of Reclamation located at 19550 Kelso Road in Byron, California as the ""C.W. `Bill' Jones Pumping Plant "".",HR
N000181,108,2003-06-16,2471,Emergency Room Modernization Act,HR
N000181,108,2003-04-08,1659,Milk Regulatory Equity Act of 2003,HR
N000181,108,2003-04-07,1650,Milk Regulatory Equity Act of 2003,HR
N000181,108,2003-01-08,309,San Joaquin River Restoration Act,HR
N000181,108,2004-06-22,688,"Commending the Government of Portugal and the Portuguese people for their long-standing friendship, stalwart leadership, and unwavering support of the United States in the effort to combat international terrorism.",HRES
H000324,117,2021-03-18,253,Celebrating the heritage of Romani Americans.,HRES
H000324,117,2021-03-10,1744,Humane Research and Testing Act of 2021,HR
H000324,117,2021-02-23,1234,Ending Corporal Punishment in Schools Act of 2021,HR
H000324,117,2021-02-18,1136,Federal Jobs Act,HR
H000324,117,2021-02-18,132,Recognizing people of African descent and Black Europeans.,HRES
H000324,117,2021-02-18,1135,LITE Act,HR
H000324,117,2021-02-18,1134,African Descent Affairs Act of 2021,HR
H000324,117,2021-02-15,1054,Teacher Victims’ Family Assistance Act of 2021,HR
H000324,117,2021-02-11,996,Congress Commission Act,HR
H000324,117,2021-01-25,469,Comprehensive Breast Reconstruction Act of 2021,HR
H000324,117,2021-01-21,400,Civics Learning Act of 2021,HR
H000324,117,2021-01-11,248,Farm-to-Market Road Repair Act of 2021,HR
H000324,117,2021-01-06,227,Build America Act of 2021,HR
H000324,116,2020-10-27,8690,Armed Forces Deferred Tax Relief Act,HR
H000324,116,2020-10-20,8633,Humane Research and Testing Act of 2020,HR
H000324,116,2020-10-13,8587,Congress Commission Act,HR
H000324,116,2020-10-09,8558,Comprehensive Breast Reconstruction Act of 2020,HR
H000324,116,2020-06-24,1017,"Providing for consideration of the bill (H.R. 51) to provide for the admission of the State of Washington, D.C. into the Union; providing for consideration of the bill (H.R. 1425) to amend the Patient Protection and Affordable Care Act to provide for a Improve Health Insurance Affordability Fund to provide for certain reinsurance payments to lower premiums in the individual health insurance market; providing for consideration of the bill (H.R. 5332) to amend the Fair Credit Reporting Act to ensure that consumer reporting agencies are providing fair and accurate information reporting in consumer reports, and for other purposes; providing for consideration of the bill (H.R. 7120) to hold law enforcement accountable for misconduct in court, improve transparency through data collection, and reform police training and policies; providing for consideration of the bill (H.R. 7301) to prevent evictions, foreclosures, and unsafe housing conditions resulting from the COVID-19 pandemic, and for other purposes; providing for consideration of the joint resolution (H.J. Res. 90) providing for congressional disapproval under chapter 8 of title 5, United States Code, of the rule submitted by the Office of the Comptroller of the Currency relating to Community Reinvestment Act Regulations; and for other purposes.",HRES
H000324,116,2020-06-18,7250,Farm-to-Market Road Repair Act of 2020,HR
H000324,116,2020-06-11,7169,National Defense Net Zero Review Act of 2020,HR
H000324,116,2020-03-12,6240,Federal Jobs Act,HR
H000324,116,2020-03-12,6239,LITE Act,HR
H000324,116,2019-12-13,5431,FAA Family and Medical Leave Act,HR
H000324,116,2019-11-21,,,
H000324,116,2019-10-31,71,Urging all nations to outlaw the dog and cat meat trade and to enforce existing laws against such trade.,HCONRES
H000324,116,2019-10-22,650,"Providing for consideration of the bill (H.R. 4617) to amend the Federal Election Campaign Act of 1971 to clarify the obligation to report acts of foreign election influence and require implementation of compliance and reporting systems by Federal campaigns to detect and report such acts, and for other purposes.",HRES
H000324,116,2019-09-26,66,Urging all nations to outlaw the dog and cat meat trade and to enforce existing laws against such trade.,HCONRES
H000324,116,2019-09-18,4388,Human Trafficking and Exploitation Prevention Training Act of 2019,HR
H000324,116,2019-09-13,4330,TRAP Act of 2019,HR
H000324,116,2019-09-09,548,"Providing for consideration of the bill (H.R. 205) to amend the Gulf of Mexico Energy Security Act of 2006 to permanently extend the moratorium on leasing in certain areas of the Gulf of Mexico; providing for consideration of the bill (H.R. 1146) to amend Public Law 115–97 (commonly known as the Tax Cuts and Jobs Act) to repeal the Arctic National Wildlife Refuge oil and gas program, and for other purposes; and providing for consideration of the bill (H.R. 1941) to amend the Outer Continental Shelf Lands Act to prohibit the Secretary of the Interior including in any leasing program certain planning areas, and for other purposes.",HRES
H000324,116,2019-07-30,4112,"To designate Haiti under section 244 of the Immigration and Nationality Act to permit nationals of Haiti to be eligible for temporary protected status under such section during and after the pendency of certain litigation, and for other purposes.",HR
H000324,116,2019-06-13,3272,Services for Ending Long-Term Homelessness Act,HR
H000324,116,2019-06-10,3166,"To direct the Secretary of Defense to modernize certain forms and surveys of the Department of Defense, and for other purposes.",HR
H000324,116,2019-05-07,2550,Prevent BLEEDing Act of 2019,HR
H000324,116,2019-04-09,297,Supporting the goals and ideals of Jubilee Day.,HRES
H000324,116,2019-04-04,2099,Wildlife VET Act,HR
H000324,116,2019-04-04,292,Celebrating the heritage of Romani Americans.,HRES
H000324,116,2019-04-02,2032,Donate for Disaster Relief Act of 2019,HR
H000324,116,2019-03-26,1877,African Descent Affairs Act of 2019,HR
H000324,116,2019-03-26,256,Recognizing people of African descent and Black Europeans.,HRES
H000324,116,2019-03-14,1787,Corey Jones Act,HR
H000324,116,2019-03-12,1691,Teacher Victims’ Family Assistance Act of 2019,HR
H000324,116,2019-03-06,,,
H000324,116,2019-03-06,1564,Outpatient Mental Health Modernization Act of 2019,HR
H000324,116,2019-02-25,1345,Restoring the Partnership for County Health Care Costs Act of 2019,HR
H000324,116,2019-02-19,138,Expressing support for addressing the Arab-Israeli conflict in a concurrent track with the Israeli-Palestinian peace process and commending Arab and Muslim-majority states that have improved bilateral relations with Israel.,HRES
H000324,113,2013-10-23,,,
H000324,113,2013-09-18,,,
H000324,113,2013-07-30,,,
H000324,113,2013-07-30,,,
H000324,113,2013-07-30,,,
H000324,113,2013-07-09,,,
H000324,113,2013-06-27,,,
H000324,113,2014-12-10,5837,African Descent Act of 2014,HR
H000324,113,2014-05-30,4790,Highways Bettering the Economy and Environment Pollinator Protection Act,HR
H000324,113,2014-02-25,4084,Community Gardening and Nutrition Act of 2014,HR
H000324,113,2013-12-04,3651,National Commission on Employment and Economic Security Act,HR
H000324,113,2013-12-03,3642,National Commission on Employment and Economic Security Act,HR
H000324,113,2013-10-15,3293,Debt Limit Reform Act,HR
H000324,113,2013-07-23,2796,Wildlife VET Act,HR
H000324,113,2013-04-09,1438,Veterans Pensions Protection Act of 2013,HR
H000324,113,2013-02-28,913,Everglades for the Next Generation Act,HR
H000324,113,2013-02-14,715,Lena Horne Recognition Act,HR
H000324,113,2013-02-05,514,Donate for Disaster Relief Act of 2013,HR
H000324,113,2013-02-04,480,To amend the Internal Revenue Code of 1986 to disallow a deduction for amounts paid or incurred by a responsible party relating to a discharge of oil.,HR
H000324,113,2013-01-23,390,National Emergency Centers Establishment Act,HR
H000324,113,2014-11-20,764,Congratulating Congresswomen Frederica S. Wilson and Ileana Ros-Lehtinen on their induction into the Miami-Dade County Public Schools Hall of Fame.,HRES
H000324,113,2014-11-12,750,"Congratulating and honoring Malala Yousafzai, recipient of the 2014 Nobel Peace Prize.",HRES
H000324,113,2014-11-12,749,"Congratulating and honoring Kailash Satyarthi, recipient of the 2014 Nobel Peace Prize.",HRES
H000324,113,2014-05-30,609,Expressing condolences and support for assistance to the victims of the historic flooding in the Western Balkans.,HRES
H000324,113,2014-04-30,561,Marking the 60th anniversary of the United States Supreme Court decision Brown v. Board of Education.,HRES
H000324,113,2013-11-19,421,Recognizing people of African Descent and Black Europeans.,HRES
H000324,113,2013-10-30,397,Recognizing the 40th anniversary of the independence of the Bahamas.,HRES
H000324,113,2013-09-12,345,"Recognizing the importance of nonprofit organizations and expressing support for designation of May 16, 2014, as ""National Nonprofit Day"".",HRES
H000324,113,2013-05-17,220,Expressing the sense of the House of Representatives regarding the contributions of the Convention on International Trade in Endangered Species of Wild Fauna and Flora.,HRES
H000324,113,2013-04-26,191,"Honoring Jacoby Dickens, the successful, community-oriented African-American financier and philanthropist in Chicago, Illinois.",HRES
H000324,113,2013-03-15,121,"Honoring Yoani Sanchez, a courageous blogger and activist for freedom in Cuba.",HRES
H000324,112,2012-07-25,,,
H000324,112,2012-07-24,,,
H000324,112,2012-07-24,,,
H000324,112,2012-07-12,,,
H000324,112,2012-07-12,,,
H000324,112,2012-03-20,,,
H000324,112,2011-11-16,,,
H000324,112,2011-09-23,,,
H000324,112,2011-07-15,,,
H000324,112,2011-06-22,,,
H000324,112,2011-05-10,,,
H000324,112,2011-05-10,,,
H000324,112,2011-05-10,,,
H000324,112,2011-02-18,,,
H000324,112,2012-08-02,6327,PCIP Improvement Act of 2012,HR
H000324,112,2012-06-07,5923,Stopping Non-Native Animals from Killing Endangered Species Act,HR
H000324,112,2012-02-02,3886,Wildlife VET Act,HR
H000324,112,2012-01-31,3852,To amend the Internal Revenue Code of 1986 to disallow a deduction for amounts paid or incurred by a responsible party relating to a discharge of oil.,HR
H000324,112,2011-12-19,3733,Affordable Mortgage for Homeowners Act of 2011,HR
H000324,112,2011-12-16,3711,White House Conference on Haiti Act of 2011,HR
H000324,112,2011-11-18,3493,National Commission on Employment and Economic Security Act,HR
H000324,112,2011-10-05,3105,Fairness in the American Tax Code Act of 2011,HR
H000324,112,2011-08-01,2744,Federal Aviation Employees Protection Act of 2011,HR
H000324,112,2011-06-24,2381,Highways Bettering the Economy and Environment Act,HR
H000324,112,2011-06-22,2285,Post-deployment Strategy Act of 2011,HR
