bioguide_id,congress,introduced_date,number,title,type
T000480,116,2020-03-05,86,Proposing an amendment to the Constitution of the United States to limit the number of consecutive terms that a Member of Congress may serve.,HJRES
T000480,116,2020-01-29,,,
T000480,116,2020-01-28,5698,Promoting Secure 5G Act of 2020,HR
T000480,116,2019-07-25,4071,To amend the Congressional Budget and Impoundment Control Act of 1974 to provide that concurrent resolutions on the budget include the recommended ratio of the public debt to the estimated gross domestic product for each fiscal year covered by the resolution.,HR
S001219,117,2022-11-29,9363,Smithsonian Modernization Act of 2022,HR
R000579,118,2023-04-10,2573,"To express the Sense of Congress with respect to Federal preemption of State restrictions on dispensing medication abortion, and for other purposes.",HR
R000579,118,2023-02-14,1045,"To amend title 10, United States Code, to improve dependent coverage under the TRICARE Young Adult Program.",HR
R000579,117,2022-09-22,8976,Protecting Reproductive Freedom Act,HR
R000579,117,2022-09-19,8875,Expanding Home Loans for Guard and Reservists Act,HR
P000619,118,2023-04-18,2687,"To amend the Alaska Native Claims Settlement Act to exclude certain payments to aged, blind, or disabled Alaska Natives or descendants of Alaska Natives from being used to determine eligibility for certain programs, and for other purposes.",HR
P000619,117,2022-12-12,9496,Alaska Land Conveyances and Trails Act,HR
P000619,117,2022-12-06,9442,Colonel Mary Louise Rasmuson Campus of the Alaska VA Healthcare System Act of 2022,HR
P000619,117,2022-11-14,9295,"To amend the Alaska Native Claims Settlement Act to provide that Alexander Creek, Incorporated, is recognized as a Village Corporation under that Act, and for other purposes.",HR
P000619,117,2022-11-03,9269,"To amend the Alaska Native Claims Settlement Act to exclude certain payments to aged, blind, or disabled Alaska Natives or descendants of Alaska Natives from being used to determine eligibility for certain programs, and for other purposes.",HR
P000619,117,2022-09-30,9117,To make permanent the authority of the Secretary of Veterans Affairs to make grants for the transportation of highly rural veterans to medical care.,HR
P000619,117,2022-09-30,9118,Cruising for Alaska's Workforce Act,HR
P000619,117,2022-09-30,9115,Explore America Act of 2022,HR
P000619,117,2022-09-30,9116,Unrecognized Southeast Alaska Native Communities Recognition and Compensation Act,HR
P000619,117,2022-09-30,9111,INFANT Act,HR
P000619,117,2022-09-30,9112,United States Ambassador at Large for Arctic Affairs Act of 2022,HR
P000619,117,2022-09-30,9113,POWER 2.0 Act,HR
P000619,117,2022-09-30,9114,Native American Millennium Challenge Demonstration Act,HR
P000619,117,2022-09-19,8888,Food Security for All Veterans Act,HR
M001215,118,2023-03-30,2434,Next Generation Fuels Act of 2023,HR
M001215,118,2023-03-24,1790,Biologics Competition Act of 2023,HR
M001215,118,2023-03-17,1645,Biochar Research Network Act of 2023,HR
M001215,118,2023-03-10,1557,BID Act of 2023,HR
M001215,118,2023-02-27,1216,Know Before You Owe Federal Student Loan Act of 2023,HR
M001215,118,2023-02-24,1190,Disclosing Foreign Influence in Lobbying Act,HR
M001215,117,2022-09-29,9067,BID Act of 2022,HR
M001215,117,2022-09-28,9012,Stay Off My Line Act,HR
M001215,117,2022-09-20,8923,Know Before You Owe Federal Student Loan Act of 2022,HR
M001215,117,2022-09-19,8877,Biologics Competition Act of 2022,HR
M001215,117,2022-07-29,8596,Biochar Research Network Act of 2022,HR
M001215,117,2022-06-28,8246,Disclosing Foreign Influence in Lobbying Act,HR
M001215,117,2022-06-24,8230,BUILD IT Act,HR
M001215,117,2022-06-08,7979,Securing Our Schools Act of 2022,HR
M001215,117,2022-05-17,,,
M001215,117,2022-03-02,,,
M001215,117,2021-11-18,6045,Subscribe to Local News Act of 2021,HR
M001215,117,2021-11-12,5959,CHOICE Act,HR
M001215,117,2021-07-20,4571,SERVICE Act of 2021,HR
M001215,117,2021-07-09,4392,Flag Standardization Act of 2021,HR
M001215,117,2021-07-09,4391,Responsibility for Unaccompanied Minors Act,HR
M001215,117,2021-07-01,4297,Supporting Working Mothers Act,HR
M001215,117,2021-06-30,4248,Workflex in the 21st Century Act,HR
M001215,117,2021-10-20,5645,Save Our Servicemembers Act of 2021,HR
M001215,117,2021-10-08,5529,Veterans Justice Outreach Improvement Act,HR
M001215,117,2021-10-05,5498,Preserving Employment Visas Act,HR
M001215,117,2021-09-30,5432,COVID–19 Testing Coverage Act of 2021,HR
M001215,117,2021-08-27,5117,Ensuring Evacuation from Afghanistan Act of 2021,HR
M001215,117,2021-07-01,4300,Alexander Lofgren Veterans in Parks (VIP) Act,HR
M001215,117,2021-06-17,484,Expressing the sense of the House of Representatives that the United States should not waive intellectual property rights relating to COVID-19 vaccines or treatments.,HRES
M001215,117,2021-05-28,3615,Child Care Funds Accountability Act,HR
M001215,117,2021-05-17,3263,DHS Medical Countermeasures Act,HR
M001215,117,2021-04-30,2932,Veterans CARE Act,HR
M001215,117,2021-04-15,,,
M001215,117,2021-04-15,2591,DUMP Opioids Act,HR
M001215,117,2021-04-14,318,"Expressing the sense of the House of Representatives that clean water is a national priority and that the April 21, 2020, Navigable Waters Protection Rule should not be withdrawn or vacated.",HRES
M001215,117,2021-04-01,2335,VET TEC Enhancement Act of 2021,HR
M001215,117,2021-03-16,1897,REACT Act,HR
F000473,117,2022-09-29,9050,Enhancing DHS Drug Seizures Act,HR
F000473,117,2022-09-28,9001,Reduce Gun Violence Act of 2022,HR
F000474,117,2022-12-07,9450,Connecting Small Businesses with Capital Act,HR
F000475,118,2023-03-30,2423,Farm Credit Administration Independent Authority Act,HR
F000475,118,2023-03-17,1623,"To amend the Homeland Security Act of 2002 to exclude certain propane storage facilities from certain chemical security standards under the Department of Homeland Security, and for other purposes.",HR
F000475,118,2023-03-01,1290,"To amend the Food, Conservation, and Energy Act of 2008 to clarify propane storage as an eligible use for funds provided under the storage facility loan program, and for other purposes.",HR
F000475,118,2023-02-14,1011,Audit and Return It Act,HR
F000475,118,2023-01-20,414,Investing in Rural Manufacturing Act,HR
F000475,118,2023-01-12,329,American Workforce Empowerment Act,HR
F000475,118,2023-01-12,328,"To designate the facility of the United States Postal Service located at 130 North Main Street in Blue Earth, Minnesota, as the ""Jim Hagedorn Memorial Post Office"".",HR
F000475,117,2022-12-20,104,"Providing for congressional disapproval under chapter 8 of title 5, United States Code, of the rule submitted by the Department of Labor relating to ""Prudence and Loyalty in Selecting Plan Investments and Exercising Shareholder Rights"".",HJRES
E000071,117,2022-07-18,8408,Federal Mask Mandate Limitations Act,HR
E000071,117,2022-02-07,6626,"To designate the facility of the United States Postal Service located at 3903 Melear Drive in Arlington, Texas, as the ""Ron Wright Post Office Building"".",HR
E000071,117,2022-01-10,6365,"To direct the Surface Transportation Board to require any high-speed rail project to acquire all land for the project before starting construction, and for other purposes.",HR
E000071,117,2021-10-08,5516,VITAL Assessment Act,HR
C001128,117,2022-11-03,9264,Yosemite National Park Equal Access and Fairness Act,HR
C001127,118,2023-03-29,2370,Access to AEDs Act,HR
C001127,118,2023-02-09,901,Disposable ENDS Product Enforcement Act of 2023,HR
C001127,118,2023-01-31,645,Healthy Foundations for Homeless Veterans Act,HR
C001127,117,2022-11-16,1474,Recognizing the 75th anniversary of Everglades National Park.,HRES
C001127,117,2022-06-09,8003,Restore Veterans Dignity Act of 2022,HR
C001127,117,2022-06-03,7929,To amend the Internal Revenue Code of 1986 to provide for additional recovery rebates to taxpayers.,HR
C001127,117,2022-05-10,7700,People’s Prosperity Act,HR
C001125,118,2023-04-03,2457,"To establish a National Science Foundation grant program to provide opportunities for and strengthen research capacity at institutions of higher education to stimulate sustainable improvement in existing research and development at such institutions, and for other purposes.",HR
C001125,118,2023-04-03,2458,Emergency Preparedness in Higher Education Act,HR
C001125,118,2023-03-17,1619,"To amend the Richard B. Russell National School Lunch Act to require schools to provide fluid milk substitutes upon request of a student or the parent or guardian of such student, and for other purposes.",HR
C001125,118,2023-03-10,1539,"To amend the Richard B. Russell National School Lunch Act to require schools to provide fluid milk substitutes upon request of a student or the parent or guardian of such student, and for other purposes.",HR
C001125,118,2023-02-24,1174,Dr. Norman C. Francis Congressional Gold Medal Act,HR
C001125,118,2023-02-21,144,Recognizing and celebrating the 70th anniversary of the 1953 Baton Rouge Bus Boycott.,HRES
C001125,118,2023-02-14,996,"To designate the facility of the United States Postal Service located at 3901 MacArthur Blvd, in New Orleans, Louisiana, as the ""Dr. Rudy Lombard Post Office"".",HR
C001125,117,2022-12-21,9651,LIFT Act,HR
C001125,117,2022-11-10,9283,To direct the Secretary of Veterans Affairs to report on the Warrior Training Advancement Course of the Veterans Benefits Administration.,HR
C001125,117,2022-09-22,8953,Small Business Set Aside Extension Act of 2022,HR
C001125,117,2022-07-28,8557,Marijuana Misdemeanor Expungement Act,HR
C001125,117,2022-07-27,8526,Office of Disaster Recovery Act,HR
C001125,117,2022-07-27,8525,Delivering Equity and Justice for Disaster Survivors Act of 2022,HR
C001125,117,2022-07-07,8301,New Orleans Jazz National Historical Park Study Act of 2022,HR
C001125,117,2022-06-28,8241,"To designate the facility of the United States Postal Service located at 3901 MacArthur Blvd, in New Orleans, Louisiana, as the ""Dr. Rudy Lombard Post Office"".",HR
C001125,117,2022-06-23,8200,CLIMB Act,HR
C001125,117,2022-05-24,7863,Disaster Resiliency Planning Act,HR
C001125,117,2022-04-07,7451,Revitalizing Small and Local Businesses Act,HR
C001125,117,2022-03-15,7085,"To amend the Public Works and Economic Development Act of 1965 to authorize the Secretary of Commerce to make predevelopment grants, and for other purposes.",HR
C001125,117,2022-03-09,7016,General Motors Bailout Act of 2022,HR
C001125,117,2022-03-09,7017,"To designate the facility of the United States Postal Service located at 3901 MacArthur Blvd, in New Orleans, Louisiana, as the ""Dr. Rudy Lombard Post Office"".",HR
C001125,117,2022-02-04,909,Expressing support for healthcare personnel and condemning assaults on healthcare personnel as the U.S. healthcare system faces unprecedented staffing shortages and increased workplace-related stressors.,HRES
C001125,117,2021-12-20,6326,NEW START Act of 2021,HR
C001125,117,2021-12-02,6125,No Double Debt for Disaster Survivors Act of 2021,HR
C001125,117,2021-07-29,4798,Communities and Environment First Act of 2021,HR
C001125,117,2021-07-29,4797,Student Loan Relief Act,HR
Z000018,114,2016-12-12,6528,Litigation Relief for Forest Management Projects Act,HR
Z000018,114,2016-09-28,6295,CO2 Regulatory Certainty Act,HR
Z000018,114,2016-09-12,5999,Global War on Terrorism War Memorial Act,HR
Z000018,114,2016-07-13,5778,Alex Diekmann Peak Designation Act of 2016,HR
Z000018,114,2016-07-06,5633,Blackfeet Water Rights Settlement Act,HR
Z000018,114,2016-07-05,807,"Expressing support for designation of May 5, 2017, as ""National Day of Awareness for Missing and Murdered Native Women and Girls"".",HRES
Z000018,114,2016-06-15,,,
Z000018,114,2016-05-18,,,
Z000018,114,2016-05-17,,,
Z000018,114,2016-05-17,5259,Certainty for States and Tribes Act,HR
Z000018,114,2016-05-16,5257,Justice for Victims of Military Sexual Assault Act,HR
Z000018,114,2016-01-12,4375,Repeal ID Act of 2016,HR
Z000018,114,2015-12-03,553,Urging the President and the International Atomic Energy Agency (IAEA) to submit to Congress the text of all side agreements entered into between the IAEA and Iran with respect to the Joint Comprehensive Plan of Action.,HRES
Z000018,114,2015-10-29,3867,Clean Water for Rural Communities Act,HR
Z000018,114,2015-07-07,,,
Z000018,114,2015-06-15,2787,East Rosebud Wild and Scenic Rivers Act,HR
Z000018,114,2015-05-21,2567,"To posthumously award the Congressional Gold Medal to each of Glen Doherty, Tyrone Woods, J. Christopher Stevens, and Sean Smith in recognition of their contributions to the Nation.",HR
Z000018,114,2015-05-15,2358,Electricity Reliability and Forest Protection Act,HR
Z000018,114,2015-04-28,2081,To extend the deadline for commencement of construction of a hydroelectric project involving the Gibson Dam.,HR
Z000018,114,2015-03-19,1522,To amend the Internal Revenue Code of 1986 to extend and improve the Indian coal production tax credit.,HR
Z000018,114,2015-03-19,1521,"To rename the Captain William Wylie Galt Great Falls Armed Forces Readiness Center in honor of Captain John E. Moran, a recipient of the Medal of Honor.",HR
Z000018,114,2015-01-27,577,To require the Secretary of Veterans Affairs to use existing authorities to furnish health care at non-Department of Veterans Affairs facilities to veterans who live more than 40 miles driving distance from the closest medical facility of the Department that furnishes the care sought by the veteran.,HR
Z000018,114,2015-01-12,286,Little Shell Tribe of Chippewa Indians Restoration Act of 2015,HR
Z000018,114,2015-09-16,423,Expressing support for the designation of October 2015 as Special Operations Forces Appreciation Month in order to honor members of United States Special Operations Forces for their service and sacrifice on behalf of the United States.,HRES
Z000018,114,2015-06-03,2644,National Forest Collaborative Incentive Act of 2015,HR
Z000018,114,2015-04-28,2080,To reinstate and extend the deadline for commencement of construction of a hydroelectric project involving Clark Canyon Dam.,HR
L000594,116,2020-07-21,4238,Cracking Down on Gangs and Deporting Criminals Act of 2020,S
L000594,116,2020-09-21,4630,Defend Our Defenders Act of 2020,S
L000594,116,2020-06-23,4039,TELEHEALTH HSA Act of 2020,S
L000594,116,2020-05-07,3643,VA Mission Telehealth Clarification Act,S
L000594,116,2020-03-12,3468,Preventing Essential Medical Device Shortages Act of 2020,S
L000594,116,2020-06-23,40,A concurrent resolution expressing the sense of Congress that undue restrictions on the right of law-abiding gun owners to carry a firearm for self-defense outside of the home violate the Second Amendment to the Constitution of the United States.,SCONRES
L000594,116,2020-09-24,4721,Securing Our Elections Act of 2020,S
L000594,116,2020-10-21,4828,Stop Suppressing Speech Act of 2020,S
L000594,116,2020-06-23,4040,Gun Owner Privacy Act,S
L000594,116,2020-06-24,4062,Stopping Big Tech's Censorship Act,S
L000594,116,2020-12-11,5012,Holding Sexual Predators and Online Enablers Accountable Act of 2020,S
L000594,116,2020-06-01,3857,Helping Americans Return to Work Act of 2020,S
L000594,116,2020-09-10,4563,Choice for Every Child Act,S
L000594,116,2020-06-11,3942,Securing America’s Medical Supply Chain and Advancing the Production of Life Saving Medicines Act,S
L000594,116,2020-10-23,4858,Reducing Veteran Homelessness Act of 2020,S
L000594,116,2020-06-16,3970,"American Farmers, Food Banks, and Families Act of 2020",S
L000594,116,2020-03-04,3388,Woman’s Right To Know Act,S
L000594,116,2020-12-11,5011,Economic Empowerment for Underserved Communities Act,S
L000594,116,2020-09-15,4580,Training our Prosecutors Act,S
L000594,116,2020-05-21,3821,Affordable Health Care Options Act of 2020,S
L000594,116,2020-08-04,4424,Holding Rioters Accountable Act of 2020,S
L000594,116,2020-09-09,686,"A resolution honoring the service and sacrifice of members of the United States Armed Forces, veterans, prisoners of war, and Gold Star Families.",SRES
L000594,116,2020-03-11,3437,Improving Care in Rural America Reauthorization Act of 2020,S
L000594,116,2020-10-19,747,A resolution expressing the sense of the Senate condemning the politicization of the 25th Amendment to the Constitution of the United States by the Speaker of the House of Representatives.,SRES
L000594,116,2020-06-01,3860,Lessening Regulatory Costs and Establishing a Federal Regulatory Budget Act of 2020,S
L000594,116,2020-06-17,3978,Enforcing Accountability and Transparency in International Trade Act,S
L000594,116,2020-08-04,4425,Securing Commerce and Protecting Businesses Act of 2020,S
L000594,116,2020-06-08,3915,Protecting Reopening Businesses Recovering from COVID–19 Act,S
L000594,116,2020-06-23,4037,Patient Credit Protection Act of 2020,S
L000594,116,2020-09-22,4649,Protection of Women and Girls in Sports Act of 2020,S
L000594,116,2020-09-29,,,
L000594,116,2020-09-29,,,
L000594,116,2020-08-10,4520,VA–SBA Act,S
L000594,116,2020-08-06,668,A resolution commemorating the Federal Law Enforcement Training Center's 50th Anniversary.,SRES
L000594,116,2020-06-15,3960,Promoting Public Safety and Supporting Law Enforcement Act of 2020,S
L000594,116,2020-05-19,3765,Working Families Childcare Access (WFCA) Act,S
L000594,116,2020-08-06,,,
L000594,116,2020-06-08,3916,American Workforce Development Act,S
L000594,116,2020-08-03,,,
L000594,116,2020-06-11,3941,Regulatory Relief to Support Economic Recovery Act,S
L000594,116,2020-05-06,562,"A resolution designating March 25, 2020, as ""National Cerebral Palsy Awareness Day"".",SRES
L000594,116,2020-06-01,3859,PPP TIME Act,S
L000594,116,2020-05-13,3709,LIFE NOW Act,S
L000594,116,2020-06-17,3980,American Agriculture First Act,S
L000594,116,2020-06-11,3945,Bring Entrepreneurial Advancements To Consumers Here In North America Act,S
L000594,116,2020-06-25,,,
L000594,116,2020-06-09,612,"A resolution expressing the sense of the Senate that the tragic death of George Floyd was unjust and the perpetrators must stand trial and be brought to justice, the First Amendment of the Constitution guarantees individuals the right to peaceably assemble and protest, groups like Antifa and the individuals who took over peaceful protests with violence, chaos, looting, and destruction should be held accountable for their actions, the attacks on law enforcement, individuals, small businesses, and communities are causing death, injury and millions of dollars in damage, the vast majority of men and women in law enforcement work tirelessly and risk their lives to protect the people of the United States without prejudice, police departments are the cornerstone for maintaining a society of order, calls to defund the police threaten the safety and security of the people of the United States, Congress will continue to appropriate funding to local law enforcement agencies that bolster police efforts, and the Nation must come together in healing, reconciliation, and prayer to reaffirm that every life is sacred, our society must strive for equality, and that we will work to ensure a tragedy like George Floyd's never happens again in the United States.",SRES
L000594,116,2020-06-29,,,
L000594,116,2020-06-29,,,
L000594,116,2020-06-11,,,
L000594,116,2020-06-11,,,
L000594,116,2020-06-11,,,
L000594,116,2020-05-21,594,A resolution calling for the payments to States for the Child Care and Development Block Grant program to be sufficient to cover losses experienced by child care providers due to the COVID-19 pandemic.,SRES
L000594,116,2020-03-11,3438,R–DOCS Reauthorization Act of 2020,S
L000594,116,2020-03-09,,,
L000594,116,2020-03-09,,,
L000594,116,2020-03-03,,,
W000827,117,2021-01-28,626,Teleabortion Prevention Act of 2021,HR
W000827,117,2021-01-28,627,Child Custody Protection Act of 2021,HR
W000827,116,2020-05-15,6917,AIR Security Act,HR
W000827,116,2020-02-28,6041,State and National Guard Fairness Act of 2020,HR
W000827,116,2019-11-21,5250,Veterans Back to Work Act of 2019,HR
W000827,116,2019-11-14,5081,K–9 Hero Act of 2019,HR
W000827,116,2019-10-30,4935,Teleabortion Prevention Act of 2019,HR
W000827,116,2019-06-14,3291,SNACKS Act,HR
W000827,116,2019-05-23,2963,Traffic Camera Notification Act of 2019,HR
W000827,116,2019-05-23,2962,Traffic Camera Freedom Act of 2019,HR
W000827,116,2019-05-16,2817,Child Custody Protection Act of 2019,HR
W000827,116,2019-01-16,47,Condemning all forms of anti-Semitism.,HRES
W000827,116,2019-04-03,2046,Energy Diplomacy Act of 2019,HR
W000827,116,2019-02-26,1359,Digital Global Access Policy Act of 2019,HR
D000630,117,2022-04-26,7575,Green Jobs and Opportunity Act,HR
D000630,117,2022-03-09,7020,Fair Social Security for Domestic Violence Survivors Act,HR
D000630,117,2021-11-03,5839,To authorize the President to award the Medal of Honor to Charles R. Johnson for acts of valor during the Korean War while a member of the Army.,HR
D000630,117,2021-07-30,4877,One Stop Shop for Small Business Compliance Act of 2021,HR
D000630,117,2021-07-20,4558,Tax Fairness for the Self-Employed Act of 2021,HR
D000630,117,2021-10-12,5555,MADE HERE Act,HR
D000630,117,2021-09-30,5445,GO Ag Act,HR
D000630,117,2021-09-28,5395,BuyAmerican.gov Act of 2021,HR
D000630,117,2021-09-14,5249,Small Farm to School Act of 2021,HR
D000630,117,2021-08-23,5073,REACH for Veterans Act,HR
D000630,117,2021-06-29,4224,PFAS Transparency Act,HR
D000630,117,2021-06-04,3700,Clean Water for Rural America Act,HR
D000630,117,2021-06-04,3701,PIPE Act,HR
D000630,117,2021-05-25,3490,Rural Transportation Improvement Act,HR
D000630,117,2021-05-25,3491,Stamp Out Lyme Disease Act,HR
D000630,117,2021-05-04,2958,End the Limo Loophole Act,HR
D000630,117,2021-05-04,2974,Military Spouse Hiring Act,HR
D000630,117,2021-04-21,2724,VA Peer Support Enhancement for MST Survivors Act,HR
D000630,117,2021-04-08,2398,Broadband Speed Act,HR
D000630,117,2021-04-08,2399,Community Navigator Reporting Act of 2021,HR
D000630,117,2021-04-08,2400,Community Broadband Mapping Act,HR
D000630,117,2021-04-05,2360,Small Business Relief Accessibility Act,HR
D000630,117,2021-04-05,2361,Rebuild Rural America Act of 2021,HR
D000630,117,2021-02-23,1227,Medicare-X Choice Act of 2021,HR
D000630,117,2021-01-05,199,Direct Support for Communities Act,HR
D000630,116,2020-09-24,8376,Small Business Debt Relief Extension Act of 2020,HR
D000630,116,2020-07-29,7831,Small Farm to School Act of 2020,HR
D000630,116,2020-06-18,7243,Identifying PFAS at Water Infrastructure Sites Act,HR
D000630,116,2020-05-08,6748,Direct Support for Communities Act,HR
D000630,116,2020-05-08,6747,Rural Transportation Improvement Act,HR
D000630,116,2020-03-19,6304,Small Business Repayment Relief Act of 2020,HR
D000630,116,2020-03-11,6206,PREP Act of 2020,HR
D000630,116,2020-01-09,,,
D000630,116,2020-01-03,5540,PFAS Transparency Act,HR
D000630,116,2019-12-04,5299,Stamp Out Lyme Disease Act,HR
D000630,116,2019-11-21,,,
D000630,116,2019-11-20,5196,Save Lives Act,HR
D000630,116,2019-11-12,5048,Fairness for Local Veteran Cemeteries Act,HR
D000630,116,2019-10-28,4874,Rebuild Rural America Act of 2019,HR
D000630,116,2019-10-23,,,
D000630,116,2019-10-16,4697,End the Limo Loophole Act,HR
D000630,116,2019-10-11,4641,Broadband Speed Act,HR
D000630,116,2019-10-11,4642,Community Broadband Mapping Act,HR
D000630,116,2019-08-30,4216,Strengthening Financial Aid for Students Act (Strengthening FAFSA),HR
D000630,116,2019-08-06,4165,Improving Benefits for Underserved Veterans Act,HR
D000630,116,2019-08-02,4148,Green Jobs and Opportunity Act,HR
D000630,116,2019-07-23,3880,Tax Fairness for the Self-Employed Act of 2019,HR
D000630,116,2019-06-13,,,
D000630,116,2019-06-13,3254,PIPE Act,HR
D000630,116,2019-05-22,2912,Military Spouse Hiring Act,HR
D000630,116,2019-05-08,2577,PFAS Right-To-Know Act,HR
D000630,116,2019-04-18,2336,Family Farmer Relief Act of 2019,HR
D000630,116,2019-04-09,,,
D000630,116,2019-04-09,2151,"To designate the facility of the United States Postal Service located at 7722 South Main Street in Pine Plains, New York, as the Senior Chief Petty Officer Shannon M. Kent Post Office.",HR
D000630,116,2019-04-09,2142,"To amend the Small Business Act to require the Small Business and Agriculture Regulatory Enforcement Ombudsman to create a centralized website for compliance guides, and for other purposes.",HR
D000630,116,2019-04-01,2000,Medicare-X Choice Act of 2019,HR
D000630,116,2019-02-14,134,Honoring the life of Chief Petty Officer Shannon M. Kent.,HRES
D000630,116,2019-02-08,,,
D000630,116,2019-02-08,,,
D000630,116,2019-01-29,842,CLEAR Act,HR
H001080,117,2021-02-04,813,"To designate the facility of the United States Postal Service located at 1050 Sunset Road Southwest in Albuquerque, New Mexico, as the Jose Hernandez Post Office Building.",HR
H001080,116,2020-11-05,8729,Native American Language Resource Center Act,HR
H001080,116,2020-10-23,8665,Extending Tribal Broadband Priority Act of 2020,HR
H001080,116,2020-09-30,8455,Reconciliation in Place Names Act,HR
H001080,116,2020-09-29,8420,Truth and Healing Commission on Indian Boarding School Policy Act,HR
H001080,116,2020-09-25,8401,"To require the Secretary of the Interior and the Secretary of Agriculture to complete an interagency report on the effects of special recreation permits on environmental justice communities, and for other purposes.",HR
H001080,116,2020-09-24,,,
H001080,116,2020-09-23,1144,Broadband for All Resolution of 2020,HRES
